{
  "schema_version": "1.1.0",
  "case_id": "VAL-SP16-WELD-0002",
  "title": "Подбор длины и катета сварных угловых соединений — остановка на проверке сварочного материала Э42/Э42А",
  "evidence_class": "external_user_supplied_calculation_report",
  "source": {
    "original_filename": "chat_paste.txt",
    "stored_path": "validation/cases/VAL-SP16-WELD-0002/source/source_report_transcribed_from_conversation.txt",
    "sha256": "862381c2f95f542f70bccc9a7e450c5115ac998528497b0b64939593b826155b",
    "page_count": 0,
    "preservation": "structured_transcription_from_conversation; no original file attachment was supplied"
  },
  "source_reported_inputs": {
    "note": "Calculation-grade inputs are encoded in the source transcript and expected/comparison records for this validation campaign."
  },
  "source_reported_checks": [
    {
      "check_id": "kf_max",
      "published_value": 6.0
    },
    {
      "check_id": "kf_min",
      "published_value": 4.0
    },
    {
      "check_id": "R_wz",
      "published_value": 166.5
    },
    {
      "check_id": "manual_lower_bound",
      "published_value": 183.15
    },
    {
      "check_id": "compatibility_pass",
      "published_value": 0
    }
  ],
  "source_consistency_findings": [
    {
      "finding_id": "SOURCE-STOPS-BEFORE-LENGTH",
      "description": "The source title refers to weld length selection, but the report stops at the failed clause 14.1.8 consumable-compatibility gate."
    },
    {
      "finding_id": "VENDOR-KF-ROUNDING-POLICY",
      "description": "kf=int(kf,max) is a vendor selection policy; SP16 establishes admissible limits, not this exact integer-selection algorithm."
    }
  ],
  "validation_classification": {
    "overall_status": "PARTIAL_MATCH_SOURCE_STOPS_BEFORE_LENGTH",
    "count_as_full_end_to_end_golden_case": false,
    "count_as_scalar_external_replay": true,
    "directly_comparable_production_functions": [
      "standard_core.*.maximum_fillet_weld_leg_clause_14_1_7",
      "standard_core.*.minimum_fillet_weld_leg_table38",
      "standard_core.*.welding_consumable_compatibility_clause_14_1_8"
    ],
    "reason": "This campaign preserves source discrepancies and only promotes directly comparable scalar/procedure evidence."
  }
}
